{"$defs":{"capabilityState":{"enum":["unavailable","offline-validated","gpu-validated","failed"]},"completenessState":{"enum":["planned","running","complete","partial","corrupt","failed"]},"contentRef":{"additionalProperties":false,"properties":{"id":{"$ref":"#/$defs/identifier"},"kind":{"$ref":"#/$defs/identifier"},"schema_version":{"const":"1.0.0"},"sha256":{"$ref":"#/$defs/sha256"},"uri":{"minLength":1,"type":"string"}},"required":["schema_version","kind","id","sha256","uri"],"type":"object"},"identifier":{"pattern":"^[a-z0-9][a-z0-9._:-]{2,127}$","type":"string"},"moduleKind":{"enum":["router-logits","router-probabilities","route-selection","routing-weights","shared-expert-output","residual-stream","attention-input","attention-output","attention-summary","mlp-input","mlp-output","expert-input","expert-output","decoder-logits","token-confidence","kv-metadata","quantization-metadata","runtime-metadata","modality-encoder","modality-projection"]},"sha256":{"pattern":"^[0-9a-f]{64}$","type":"string"}},"$id":"https://inkling-small-ampere.invalid/schemas/mechanistic/v1/MechanisticProbeSet.schema.json","$schema":"https://json-schema.org/draft/2020-12/schema","additionalProperties":false,"properties":{"description":{"type":"string"},"id":{"$ref":"#/$defs/identifier"},"kind":{"const":"mechanistic-probe-set"},"modality_capabilities":{"additionalProperties":false,"properties":{"audio":{"$ref":"#/$defs/capabilityState"},"image":{"$ref":"#/$defs/capabilityState"},"text":{"$ref":"#/$defs/capabilityState"}},"required":["text","image","audio"],"type":"object"},"phenomenon_ref":{"$ref":"#/$defs/contentRef"},"probes":{"items":{"additionalProperties":false,"properties":{"context_tokens":{"minimum":1,"type":"integer"},"difficulty":{"maximum":1,"minimum":0,"type":"number"},"expected_outcome":{"type":"object"},"family":{"$ref":"#/$defs/identifier"},"generator":{"type":"object"},"id":{"$ref":"#/$defs/identifier"},"modality":{"enum":["text","image","audio"]},"pair_id":{"$ref":"#/$defs/identifier"},"phenomenon_id":{"$ref":"#/$defs/identifier"},"tags":{"items":{"type":"string"},"type":"array"}},"required":["id","phenomenon_id","family","generator","expected_outcome","difficulty","context_tokens","modality","tags"],"type":"object"},"minItems":1,"type":"array"},"schema_version":{"const":"1.0.0"},"sealing":{"additionalProperties":false,"properties":{"algorithm":{"const":"sha256-canonical-json-v1"},"content_sha256":{"$ref":"#/$defs/sha256"}},"required":["algorithm","content_sha256"],"type":"object"}},"required":["schema_version","kind","id","phenomenon_ref","sealing","probes","modality_capabilities"],"title":"MechanisticProbeSet","type":"object"}
